{
  "schemaVersion": "1.0.0-draft.1",
  "bookingId": "booking_example_angel_email_001",
  "version": 1,
  "status": "submitted",
  "siteId": "site_example_angel_court",
  "siteDisplayNameSnapshot": "Example Angel Court Hospitality Site",
  "commercialReference": "EXAMPLE-COST-CENTRE-02",
  "source": {
    "channel": "legacy_email_form",
    "sourceSystem": "legacy-adapter:angel-court-email-example",
    "receivedAt": "2026-07-11T10:15:00Z",
    "idempotencyKey": "legacy_example_message_001:attachment_hash_example_001",
    "references": [
      {
        "type": "email_message_id",
        "value": "example-gmail-message-id-001"
      },
      {
        "type": "attachment_hash",
        "value": "example-attachment-hash-001"
      }
    ],
    "integrationMetadata": {
      "provider": "gmail",
      "adapterVersion": "angel-court-example-adapter-v1"
    }
  },
  "customer": {
    "schemaVersion": "1.0.0-draft.1",
    "contactName": "Example Legacy Contact",
    "email": "legacy-contact@example.invalid",
    "phone": "+44 0000 000003",
    "organisationName": "Example Legacy Organisation"
  },
  "service": {
    "serviceDate": "2026-08-21",
    "startTime": "12:30",
    "endTime": "14:00",
    "timeZone": "Europe/London",
    "guestCount": 20,
    "serviceType": "lunch",
    "location": {
      "schemaVersion": "1.0.0-draft.1",
      "type": "onsite",
      "displayLabel": "Example Angel Court, Floor 3, Example Room",
      "siteId": "site_example_angel_court",
      "building": "Example Angel Court",
      "floor": "3",
      "roomOrArea": "Example Room"
    }
  },
  "items": [
    {
      "schemaVersion": "1.0.0-draft.1",
      "bookingItemId": "booking_item_example_angel_001",
      "categoryLabel": "Lunch",
      "itemName": "Example Legacy Lunch Item",
      "descriptionSnapshot": "Synthetic item parsed from a legacy booking-form fixture.",
      "servingInfoSnapshot": "Per person",
      "quantity": 20,
      "serviceTime": "12:30",
      "choices": [],
      "comments": "Synthetic fixture only.",
      "minimumQuantitySnapshot": 1,
      "minimumGuestsSnapshot": null,
      "noticeRequiredDaysSnapshot": 3,
      "validation": {
        "minimumQuantityMet": true,
        "minimumGuestsMet": true,
        "noticeMet": true
      },
      "priceSnapshot": {
        "currency": "GBP",
        "priceType": "per_person",
        "unitPriceMinor": 500,
        "lineTotalMinor": 10000,
        "calculationPolicyVersion": "angel-legacy-example-pricing-v1"
      },
      "metadata": {
        "catalogueMatchStatus": "unmapped_legacy_line"
      }
    }
  ],
  "pricingSnapshot": {
    "currency": "GBP",
    "catalogueVersion": "angel-legacy-form-example-v1",
    "pricingPolicyVersion": "angel-legacy-example-pricing-v1",
    "itemSubtotalMinor": 10000,
    "charges": [
      {
        "schemaVersion": "1.0.0-draft.1",
        "chargeId": "charge_example_angel_management_001",
        "type": "management_fee",
        "label": "Example management fee",
        "currency": "GBP",
        "amountMinor": 800,
        "taxTreatment": "taxable",
        "taxRateBasisPoints": 2000,
        "calculationPolicyVersion": "angel-legacy-example-pricing-v1"
      }
    ],
    "chargeTotalMinor": 800,
    "netTotalMinor": 10800,
    "taxLines": [
      {
        "taxLineId": "tax_example_angel_vat_001",
        "label": "VAT",
        "rateBasisPoints": 2000,
        "taxableAmountMinor": 10800,
        "taxAmountMinor": 2160
      }
    ],
    "taxTotalMinor": 2160,
    "grossTotalMinor": 12960,
    "calculatedAt": "2026-07-11T10:16:00Z",
    "calculatedBy": "actor:legacy-adapter:angel-court-example"
  },
  "dietaryRequirements": {
    "declared": false,
    "vegetarianCount": 0,
    "veganCount": 0,
    "glutenFreeCount": 0,
    "coeliacCount": 0,
    "dairyFreeCount": 0,
    "halalCount": 0,
    "otherCount": 0
  },
  "acknowledgements": [],
  "specialInstructions": "Synthetic legacy-form fixture; no private customer data.",
  "validation": {
    "status": "needs_review",
    "issues": [
      {
        "code": "legacy_acknowledgements_not_captured",
        "severity": "warning",
        "message": "The legacy source did not provide verifiable policy acknowledgements.",
        "fieldPath": "acknowledgements"
      },
      {
        "code": "legacy_catalogue_item_unmapped",
        "severity": "warning",
        "message": "The legacy line item has not been matched to a stable catalogue item ID.",
        "fieldPath": "items[0].catalogueItemId"
      }
    ],
    "validatedAt": "2026-07-11T10:16:00Z",
    "validatedBy": "actor:legacy-adapter:angel-court-example"
  },
  "createdAt": "2026-07-11T10:16:00Z",
  "updatedAt": "2026-07-11T10:16:00Z",
  "createdBy": "actor:legacy-adapter:angel-court-example",
  "updatedBy": "actor:legacy-adapter:angel-court-example"
}
